[{"schemaVersion":"1.0","eventId":"2173404-000031","runId":"qwen35-a3b-w8a8-20260710-p3r2","timestampNs":14695618346219782,"wallTime":1783661703704751258,"pid":2173404,"rank":"1","processRole":"worker","hostname":"<REMOTE_HOST>","phase":"warmup","logicalStep":{"kind":"warmup","index":0},"stage":"vllm_ascend.worker.model_runner_v1.NPUModelRunner.profile_run.start","fidelity":"STRUCTURAL","payload":{"args":[],"kwargs":{}}},{"schemaVersion":"1.0","eventId":"2173381-000031","runId":"qwen35-a3b-w8a8-20260710-p3r2","timestampNs":14695619889560395,"wallTime":1783661705248091951,"pid":2173381,"rank":"0","processRole":"worker","hostname":"<REMOTE_HOST>","phase":"warmup","logicalStep":{"kind":"warmup","index":0},"stage":"vllm_ascend.worker.model_runner_v1.NPUModelRunner.profile_run.start","fidelity":"STRUCTURAL","payload":{"args":[],"kwargs":{}}},{"schemaVersion":"1.0","eventId":"2173404-000032","runId":"qwen35-a3b-w8a8-20260710-p3r2","timestampNs":14695621249163233,"wallTime":1783661706607694799,"pid":2173404,"rank":"1","processRole":"worker","hostname":"<REMOTE_HOST>","phase":"warmup","logicalStep":{"kind":"warmup","index":0},"stage":"vllm_ascend.worker.model_runner_v1.NPUModelRunner._model_forward.start","fidelity":"STRUCTURAL","payload":{"args":[8192,null,{"kind":"tensor","shape":[3,8192],"dtype":"torch.int64","device":"npu:1","numel":24576},null],"kwargs":{}}},{"schemaVersion":"1.0","eventId":"2173381-000032","runId":"qwen35-a3b-w8a8-20260710-p3r2","timestampNs":14695621253462626,"wallTime":1783661706611994392,"pid":2173381,"rank":"0","processRole":"worker","hostname":"<REMOTE_HOST>","phase":"warmup","logicalStep":{"kind":"warmup","index":0},"stage":"vllm_ascend.worker.model_runner_v1.NPUModelRunner._model_forward.start","fidelity":"STRUCTURAL","payload":{"args":[8192,null,{"kind":"tensor","shape":[3,8192],"dtype":"torch.int64","device":"npu:0","numel":24576},null],"kwargs":{}}},{"schemaVersion":"1.0","eventId":"2173404-000033","runId":"qwen35-a3b-w8a8-20260710-p3r2","timestampNs":14695621529166610,"wallTime":1783661706887698526,"pid":2173404,"rank":"1","processRole":"worker","hostname":"<REMOTE_HOST>","phase":"warmup","logicalStep":{"kind":"warmup","index":0},"stage":"vllm_ascend.worker.model_runner_v1.NPUModelRunner._model_forward.end","fidelity":"SUMMARY","payload":{"durationNs":280026207,"result":{"kind":"tensor","shape":[8192,2048],"dtype":"torch.bfloat16","device":"npu:1","numel":16777216}}},{"schemaVersion":"1.0","eventId":"2173381-000033","runId":"qwen35-a3b-w8a8-20260710-p3r2","timestampNs":14695621552594743,"wallTime":1783661706911126489,"pid":2173381,"rank":"0","processRole":"worker","hostname":"<REMOTE_HOST>","phase":"warmup","logicalStep":{"kind":"warmup","index":0},"stage":"vllm_ascend.worker.model_runner_v1.NPUModelRunner._model_forward.end","fidelity":"SUMMARY","payload":{"durationNs":299152266,"result":{"kind":"tensor","shape":[8192,2048],"dtype":"torch.bfloat16","device":"npu:0","numel":16777216}}},{"schemaVersion":"1.0","eventId":"2173381-000034","runId":"qwen35-a3b-w8a8-20260710-p3r2","timestampNs":14695626305397970,"wallTime":1783661711663929796,"pid":2173381,"rank":"0","processRole":"worker","hostname":"<REMOTE_HOST>","phase":"warmup","logicalStep":{"kind":"warmup","index":0},"stage":"vllm_ascend.worker.model_runner_v1.NPUModelRunner.profile_run.end","fidelity":"SUMMARY","payload":{"durationNs":6415828335,"result":null}},{"schemaVersion":"1.0","eventId":"2173404-000034","runId":"qwen35-a3b-w8a8-20260710-p3r2","timestampNs":14695626332166739,"wallTime":1783661711690698565,"pid":2173404,"rank":"1","processRole":"worker","hostname":"<REMOTE_HOST>","phase":"warmup","logicalStep":{"kind":"warmup","index":0},"stage":"vllm_ascend.worker.model_runner_v1.NPUModelRunner.profile_run.end","fidelity":"SUMMARY","payload":{"durationNs":7985939558,"result":null}}]